title,byline,link,issue_number,date,category
Mom Heart,by Will McIntosh,https://clarkesworldmagazine.com/mcintosh_11_21,ISSUE 182 , November 2021,Fiction
Dark Waters Still Flow,by Alice Towey,https://clarkesworldmagazine.com/towey_11_21,ISSUE 182 , November 2021,Fiction
"This Stitch, This Time",by Anna Martino,https://clarkesworldmagazine.com/martino_11_21,ISSUE 182 , November 2021,Fiction
City of Eternity,"by Pan Haitian, translated by Carmen Yiling Yan",https://clarkesworldmagazine.com/pan_11_21,ISSUE 182 , November 2021,Fiction
The Language Birds Speak,by Rebecca Campbell,https://clarkesworldmagazine.com/campbell_11_21,ISSUE 182 , November 2021,Fiction
Between Zero and One There is Infinity,by Shari Paul,https://clarkesworldmagazine.com/paul_11_21,ISSUE 182 , November 2021,Fiction
The Death Haiku of the Azure Five,by L Chan,https://clarkesworldmagazine.com/chan_11_21,ISSUE 182 , November 2021,Fiction
Navigating the Storms of the Mind,by Douglas F. Dluzen,https://clarkesworldmagazine.com/dluzen_11_21,ISSUE 182 , November 2021,Non-fiction
Celebrating the Diversity of Chinese Culture: A Conversation with Xueting Christine Ni,by Arley Sorg,https://clarkesworldmagazine.com/ni_interview,ISSUE 182 , November 2021,Non-fiction
Explicit Queerness: A Conversation with Charlie Jane Anders,by Arley Sorg,https://clarkesworldmagazine.com/anders_interview_2021,ISSUE 182 , November 2021,Non-fiction
Editor's Desk: Changing the Conventional Wisdom,by Neil Clarke,https://clarkesworldmagazine.com/clarke_11_21,ISSUE 182 , November 2021,Non-fiction
Space Cadet,by Pascal Blanché,https://clarkesworldmagazine.com/artbio_182,ISSUE 182 , November 2021,Cover
