title,byline,link,issue_number,date,category
The Spoil Heap,by Fiona Moore,https://clarkesworldmagazine.com/moore_03_23,ISSUE 198 , March 2023,Fiction
"Bek, Ascendant",by Shari Paul,https://clarkesworldmagazine.com/paul_03_23,ISSUE 198 , March 2023,Fiction
Failure to Convert,by Shih-Li Kow,https://clarkesworldmagazine.com/kow_03_23,ISSUE 198 , March 2023,Fiction
Zeta-Epsilon,by Isabel J. Kim,https://clarkesworldmagazine.com/kim_03_23,ISSUE 198 , March 2023,Fiction
AI Aboard the Golden Parrot,by Louise Hughes,https://clarkesworldmagazine.com/hughes_03_23,ISSUE 198 , March 2023,Fiction
Love is a Process of Unbecoming,by Jonathan Kincade,https://clarkesworldmagazine.com/kincade_03_23,ISSUE 198 , March 2023,Fiction
“The Greenery Around Me Held Secrets I Would Never Learn”: Plant Life in Contemporary Science Fiction,by Samantha Hind,https://clarkesworldmagazine.com/hind_03_23,ISSUE 198 , March 2023,Non-fiction
Clones And Consciousness: A Conversation with Nadia Afifi,by Arley Sorg,https://clarkesworldmagazine.com/afifi_interview,ISSUE 198 , March 2023,Non-fiction
Striking A Balance: A Conversation with Janice L. Newman and Gideon Marcus of Galactic Journey,by Arley Sorg,https://clarkesworldmagazine.com/journey_interview,ISSUE 198 , March 2023,Non-fiction
Editor's Desk: An Important One,by Neil Clarke,https://clarkesworldmagazine.com/clarke_03_23,ISSUE 198 , March 2023,Non-fiction
The Best from 2022,by Neil Clarke,https://clarkesworldmagazine.com/readers_poll_2022,ISSUE 198 , March 2023,Non-fiction
Home,by Alex Rommel,https://clarkesworldmagazine.com/artbio_198,ISSUE 198 , March 2023,Cover
Re/Union,by L Chan,https://clarkesworldmagazine.com/chan_04_23,ISSUE 199 , April 2023,Fiction
"There Are the Art-Makers, Dreamers of Dreams, and There Are Ais",by Andrea Kriz,https://clarkesworldmagazine.com/kriz_04_23,ISSUE 199 , April 2023,Fiction
Rake the Leaves,by R.T. Ester,https://clarkesworldmagazine.com/ester_04_23,ISSUE 199 , April 2023,Fiction
Keeper of the Code,by Nick Thomas,https://clarkesworldmagazine.com/thomas_04_23,ISSUE 199 , April 2023,Fiction
Happiness,by Octavia Cade,https://clarkesworldmagazine.com/cade_04_23,ISSUE 199 , April 2023,Fiction
Stranger Shores,by Gregory Feeley,https://clarkesworldmagazine.com/feeley_04_23,ISSUE 199 , April 2023,Fiction
The Librarian and the Robot,"by Shi Heiyao, translated by Andy Dudak",https://clarkesworldmagazine.com/shi_04_23,ISSUE 199 , April 2023,Fiction
Voices Singing in the Void,by Rajan Khanna,https://clarkesworldmagazine.com/khanna_04_23,ISSUE 199 , April 2023,Fiction
"Brains in a Jar, Video Games in a Petri Dish",by Priya Sridhar,https://clarkesworldmagazine.com/sridhar_04_23,ISSUE 199 , April 2023,Non-fiction
"Stellar Synergy: A Conversation with Susan Forest, Julie Nováková, and Lucas K. Law",by Arley Sorg,https://clarkesworldmagazine.com/life_beyond_interview,ISSUE 199 , April 2023,Non-fiction
Buddhas in the Machine: Conversations with Han Song and Michael Berry,by Arley Sorg,https://clarkesworldmagazine.com/hospital_interview,ISSUE 199 , April 2023,Non-fiction
Editor's Desk: Written by a Human,by Neil Clarke,https://clarkesworldmagazine.com/clarke_04_23,ISSUE 199 , April 2023,Non-fiction
Android,by Lyss Menold,https://clarkesworldmagazine.com/artbio_199,ISSUE 199 , April 2023,Cover
"There Are the Art-Makers, Dreamers of Dreams, and There Are AIs",by Andrea Kriz,https://clarkesworldmagazine.com/kriz_04_23,ISSUE 199 , April 2023,Fiction
Better Living Through Algorithms,by Naomi Kritzer,https://clarkesworldmagazine.com/kritzer_05_23,ISSUE 200 , May 2023,Fiction
Through the Roof of the World,by Harry Turtledove,https://clarkesworldmagazine.com/turtledove_05_23,ISSUE 200 , May 2023,Fiction
To Sail Beyond the Botnet,by Suzanne Palmer,https://clarkesworldmagazine.com/palmer_05_23,ISSUE 200 , May 2023,Fiction
"LOL, Said the Scorpion",by Rich Larson,https://clarkesworldmagazine.com/larson_05_23,ISSUE 200 , May 2023,Fiction
Sensation and Sensibility,by Parker Ragland,https://clarkesworldmagazine.com/ragland_05_23,ISSUE 200 , May 2023,Fiction
The Giants Among Us,by Megan Chee,https://clarkesworldmagazine.com/chee_05_23,ISSUE 200 , May 2023,Fiction
Action at a Distance,"by An Hao, translated by Andy Dudak",https://clarkesworldmagazine.com/an_05_23,ISSUE 200 , May 2023,Fiction
The Fall,by Jordan Chase-Young,https://clarkesworldmagazine.com/chase-young_05_23,ISSUE 200 , May 2023,Fiction
Horror and Science Fiction: Genre's Evil Twins,by Carrie Sessarego,https://clarkesworldmagazine.com/sessarego_05_23,ISSUE 200 , May 2023,Non-fiction
Gods Aren't Necessarily Nice: A Conversation with Premee Mohamed,by Arley Sorg,https://clarkesworldmagazine.com/mohamed_interview,ISSUE 200 , May 2023,Non-fiction
Exploration And Healing: A Conversation with Megan O'Keefe,by Arley Sorg,https://clarkesworldmagazine.com/okeefe_interview,ISSUE 200 , May 2023,Non-fiction
Editor's Desk: Something Went Mostly Right,by Neil Clarke,https://clarkesworldmagazine.com/clarke_05_23,ISSUE 200 , May 2023,Non-fiction
Taking a Sample,by Arthur Haas,https://clarkesworldmagazine.com/artbio_200,ISSUE 200 , May 2023,Cover
The Officiant,by Dominica Phetteplace,https://clarkesworldmagazine.com/phetteplace_06_23,ISSUE 201 , June 2023,Fiction
Vast and Trunkless Legs of Stone,by Carrie Vaughn,https://clarkesworldmagazine.com/vaughn_06_23,ISSUE 201 , June 2023,Fiction
Day Ten Thousand,by Isabel J. Kim,https://clarkesworldmagazine.com/kim_06_23,ISSUE 201 , June 2023,Fiction
Imagine: Purple-Haired Girl Shooting Down the Moon,by Angela Liu,https://clarkesworldmagazine.com/liu_06_23,ISSUE 201 , June 2023,Fiction
The Moon Rabbi,by David Ebenbach,https://clarkesworldmagazine.com/ebenbach_06_23,ISSUE 201 , June 2023,Fiction
. . . Your Little Light,by Jana Bianchi,https://clarkesworldmagazine.com/bianchi_06_23,ISSUE 201 , June 2023,Fiction
To Helen,by Bella Han,https://clarkesworldmagazine.com/han_06_23,ISSUE 201 , June 2023,Fiction
Mirror View,by Rajeev Prasad,https://clarkesworldmagazine.com/prasad_06_23,ISSUE 201 , June 2023,Fiction
"Life without Water, and Where to Find It",by Julie Nováková,https://clarkesworldmagazine.com/novakova_06_23,ISSUE 201 , June 2023,Non-fiction
Decades of Aspiration: A Conversation with Vajra Chandrasekera,by Arley Sorg,https://clarkesworldmagazine.com/chandrasekera_interview,ISSUE 201 , June 2023,Non-fiction
Stories about Unnamed People: A Conversation with Kemi Ashing-Giwa,by Arley Sorg,https://clarkesworldmagazine.com/ashing-giwa_interview,ISSUE 201 , June 2023,Non-fiction
Editor's Desk: Do I Have To?,by Neil Clarke,https://clarkesworldmagazine.com/clarke_06_23,ISSUE 201 , June 2023,Non-fiction
Raid,by Pascal Blanché,https://clarkesworldmagazine.com/artbio_201,ISSUE 201 , June 2023,Cover
Cheaper to Replace,by Marie Vibbert,https://clarkesworldmagazine.com/vibbert_07_23,ISSUE 202 , July 2023,Fiction
"Death and Redemption, Somewhere Near Tuba City",by Lou J Berger,https://clarkesworldmagazine.com/berger_07_23,ISSUE 202 , July 2023,Fiction
Estivation Troubles,by Bo Balder,https://clarkesworldmagazine.com/balder_07_23,ISSUE 202 , July 2023,Fiction
Clio's Scroll,by Brenda W. Clough,https://clarkesworldmagazine.com/clough_07_23,ISSUE 202 , July 2023,Fiction
Tigers for Sale,by Risa Wolf,https://clarkesworldmagazine.com/wolf_07_23,ISSUE 202 , July 2023,Fiction
Timelock,by Davian Aw,https://clarkesworldmagazine.com/aw_07_23,ISSUE 202 , July 2023,Fiction
"What Remains, the Echoes of a Flute Song",by Alexandra Seidel,https://clarkesworldmagazine.com/seidel_07_23,ISSUE 202 , July 2023,Fiction
The Orchard of Tomorrow,by Kelsea Yu,https://clarkesworldmagazine.com/yu_07_23,ISSUE 202 , July 2023,Fiction
Margaret the First and The Blazing World,by Carrie Sessarego,https://clarkesworldmagazine.com/sessarego_07_23,ISSUE 202 , July 2023,Non-fiction
Colorful Tales: A Conversation with Yukimi Ogawa,by Arley Sorg,https://clarkesworldmagazine.com/ogawa_interview,ISSUE 202 , July 2023,Non-fiction
Riding On a Toy Train: A Conversation with Aimee Ogden,by Arley Sorg,https://clarkesworldmagazine.com/ogden_interview,ISSUE 202 , July 2023,Non-fiction
Editor's Desk: Things Only Sort of Change,by Neil Clarke,https://clarkesworldmagazine.com/clarke_07_23,ISSUE 202 , July 2023,Non-fiction
Autumn Pond,by Sergio Rebolledo,https://clarkesworldmagazine.com/artbio_202,ISSUE 202 , July 2023,Cover
Every Seed Is a Prayer (And Your World Is a Seed),by Stephen Case,https://clarkesworldmagazine.com/case_08_23,ISSUE 203 , August 2023,Fiction
Window Boy,by Thomas Ha,https://clarkesworldmagazine.com/ha_08_23,ISSUE 203 , August 2023,Fiction
Light Speed Is Not a Speed,by Andy Dudak,https://clarkesworldmagazine.com/dudak_08_23,ISSUE 203 , August 2023,Fiction
Who Can Have the Moon,"by Congyun 'Muming' Gu, translated by Tian Huang",https://clarkesworldmagazine.com/gu_08_23,ISSUE 203 , August 2023,Fiction
Empathetic Ear,by M. J. Pettit,https://clarkesworldmagazine.com/pettit_08_23,ISSUE 203 , August 2023,Fiction
Gel Pen Notes from Generation Ship Y,by Marisca Pichette,https://clarkesworldmagazine.com/pichette_08_23,ISSUE 203 , August 2023,Fiction
Resistant,by Koji A. Dae,https://clarkesworldmagazine.com/dae_08_23,ISSUE 203 , August 2023,Fiction
There's a New Octopus Sheriff in Town,by Priya Sridhar,https://clarkesworldmagazine.com/sridhar_08_23,ISSUE 203 , August 2023,Non-fiction
Sense And Perception: A Conversation with Emma Mieko Candon,by Arley Sorg,https://clarkesworldmagazine.com/candon_interview,ISSUE 203 , August 2023,Non-fiction
Everything Goes In Cycles: An Interview with Joshua Glenn,by Arley Sorg,https://clarkesworldmagazine.com/glenn_interview,ISSUE 203 , August 2023,Non-fiction
Editor's Desk: One for the Team,by Neil Clarke,https://clarkesworldmagazine.com/clarke_08_23,ISSUE 203 , August 2023,Non-fiction
Old Ways,by J.R. Slattum,https://clarkesworldmagazine.com/artbio_203,ISSUE 203 , August 2023,Cover
Stones,by Nnedi Okorafor,https://clarkesworldmagazine.com/okorafor_09_23,ISSUE 204 , September 2023,Fiction
The Queen of Calligraphic Susurrations,by D.A. Xiaolin Spires,https://clarkesworldmagazine.com/spires_09_23,ISSUE 204 , September 2023,Fiction
A Guide to Matchmaking on Station 9,by Nika Murphy,https://clarkesworldmagazine.com/murphy_09_23,ISSUE 204 , September 2023,Fiction
Axiom of Dreams,by Arula Ratnakar,https://clarkesworldmagazine.com/ratnakar_09_23,ISSUE 204 , September 2023,Fiction
The People from the Dead Whale,"by Djuna, translated by Jihyun Park and Gord Sellar",https://clarkesworldmagazine.com/djuna_09_23,ISSUE 204 , September 2023,Fiction
"The Five Remembrances, According to STE-319",by R. L. Meza,https://clarkesworldmagazine.com/meza_09_23,ISSUE 204 , September 2023,Fiction
Upgrade Day,by RJ Taylor,https://clarkesworldmagazine.com/taylor_09_23,ISSUE 204 , September 2023,Fiction
Beyond the Godzilla Trope: Radiation Biology,by Julie Nováková,https://clarkesworldmagazine.com/novakova_09_23,ISSUE 204 , September 2023,Non-fiction
Violent Revolutions: A Conversation with S.L. Huang,by Arley Sorg,https://clarkesworldmagazine.com/huang_interview,ISSUE 204 , September 2023,Non-fiction
Global Discovery: A Conversation with Jared Shurin,by Arley Sorg,https://clarkesworldmagazine.com/shurin_interview,ISSUE 204 , September 2023,Non-fiction
Editor's Desk: A Farewell to Kindle Subscriptions,by Neil Clarke,https://clarkesworldmagazine.com/clarke_09_23,ISSUE 204 , September 2023,Non-fiction
Escape,by Ignacio Bazan-Lazcano,https://clarkesworldmagazine.com/artbio_204,ISSUE 204 , September 2023,Cover
Possibly Just About A Couch,by Suzanne Palmer,https://clarkesworldmagazine.com/palmer_10_23,ISSUE 205 , October 2023,Fiction
The Blaumilch,by Lavie Tidhar,https://clarkesworldmagazine.com/tidhar_10_23,ISSUE 205 , October 2023,Fiction
Down To The Root,by Lisa Papademetriou,https://clarkesworldmagazine.com/papademetriou_10_23,ISSUE 205 , October 2023,Fiction
Such Is My Idea Of Happiness,by David Goodman,https://clarkesworldmagazine.com/goodman_10_23,ISSUE 205 , October 2023,Fiction
"De Profundis, a Space Love Letter",by Bella Han,https://clarkesworldmagazine.com/han_10_23,ISSUE 205 , October 2023,Fiction
Post Hacking for the Uninitiated,by Grace Chan,https://clarkesworldmagazine.com/chan_10_23,ISSUE 205 , October 2023,Fiction
Rafi,by Amal Singh,https://clarkesworldmagazine.com/singh_10_23,ISSUE 205 , October 2023,Fiction
Timothy: An Oral History,by Michael Swanwick,https://clarkesworldmagazine.com/swanwick_10_23,ISSUE 205 , October 2023,Fiction
Gardens in the Sky: Gardening in Science Fiction,by Carrie Sessarego,https://clarkesworldmagazine.com/sessarego_10_23,ISSUE 205 , October 2023,Non-fiction
Heartbreak and Happy Endings: A Conversation with Kij Johnson,by Arley Sorg,https://clarkesworldmagazine.com/johnson_interview_2023,ISSUE 205 , October 2023,Non-fiction
"Deep Oceans, Vast Skies: A Conversation with Margrét Helgadóttir",by Arley Sorg,https://clarkesworldmagazine.com/helgadottir_interview,ISSUE 205 , October 2023,Non-fiction
Editor's Desk: Seventeen,by Neil Clarke,https://clarkesworldmagazine.com/clarke_10_23,ISSUE 205 , October 2023,Non-fiction
Utopia #2,by Dofresh,https://clarkesworldmagazine.com/artbio_205,ISSUE 205 , October 2023,Cover
Eddies are the Worst,by Bo Balder,https://clarkesworldmagazine.com/balder_11_23,ISSUE 206 , November 2023,Fiction
Bird-Girl Builds a Machine,by Hannah Yang,https://clarkesworldmagazine.com/yang_11_23,ISSUE 206 , November 2023,Fiction
The Long Mural,by James Van Pelt,https://clarkesworldmagazine.com/vanpelt_11_23,ISSUE 206 , November 2023,Fiction
The Parts That Make Me,by Louise Hughes,https://clarkesworldmagazine.com/hughes_11_23,ISSUE 206 , November 2023,Fiction
The Mub,by Thomas Ha,https://clarkesworldmagazine.com/ha_11_23,ISSUE 206 , November 2023,Fiction
Eight or Die (Part 1),by Thoraiya Dyer,https://clarkesworldmagazine.com/dyer_11_23,ISSUE 206 , November 2023,Fiction
Thin Ice,by Kemi Ashing-Giwa,https://clarkesworldmagazine.com/ashing-giwa_11_23,ISSUE 206 , November 2023,Fiction
To Carry You Inside You,by Tia Tashiro,https://clarkesworldmagazine.com/tashiro_11_23,ISSUE 206 , November 2023,Fiction
Space Vineyards and Microgravity Wine,by Priya Sridhar,https://clarkesworldmagazine.com/sridhar_11_23,ISSUE 206 , November 2023,Non-fiction
Everybody Loves A Rogue: A Conversation with David D. Levine,by Arley Sorg,https://clarkesworldmagazine.com/levine_interview,ISSUE 206 , November 2023,Non-fiction
Head-Over-Heels: A Conversation with Cory Doctorow,by Arley Sorg,https://clarkesworldmagazine.com/doctorow_interview_2023,ISSUE 206 , November 2023,Non-fiction
Editor's Desk: This Would Have Been Longer,by Neil Clarke,https://clarkesworldmagazine.com/clarke_11_23,ISSUE 206 , November 2023,Non-fiction
The pirates on the beach,by Dofresh,https://clarkesworldmagazine.com/artbio_206,ISSUE 206 , November 2023,Cover
Morag's Boy,by Fiona Moore,https://clarkesworldmagazine.com/moore_12_23,ISSUE 207 , December 2023,Fiction
Thirteen Ways of Looking at a Cyborg,by Samara Auman,https://clarkesworldmagazine.com/auman_12_23,ISSUE 207 , December 2023,Fiction
In Memories We Drown,by Kelsea Yu,https://clarkesworldmagazine.com/yu_12_23,ISSUE 207 , December 2023,Fiction
Waffles Are Only Goodbye for Now,by Ryan Cole,https://clarkesworldmagazine.com/cole_12_23,ISSUE 207 , December 2023,Fiction
The World's Wife,by Ng Yi-Sheng,https://clarkesworldmagazine.com/yi-sheng_12_23,ISSUE 207 , December 2023,Fiction
The Last Gamemaster in the World,by Angela Liu,https://clarkesworldmagazine.com/liu_12_23,ISSUE 207 , December 2023,Fiction
Kill That Groundhog,"by Fu Qiang, translated by Andy Dudak",https://clarkesworldmagazine.com/fu_12_23,ISSUE 207 , December 2023,Fiction
Eight or Die (Part 2),by Thoraiya Dyer,https://clarkesworldmagazine.com/dyer_12_23,ISSUE 207 , December 2023,Fiction
The Season in Space,by Carrie Sessarego,https://clarkesworldmagazine.com/sessarego_12_23,ISSUE 207 , December 2023,Non-fiction
Students Are the Future of Science Fiction: A Conversation with RiverFlow,by Arley Sorg,https://clarkesworldmagazine.com/riverflow_interview,ISSUE 207 , December 2023,Non-fiction
Reinventing Everything: A Conversation with Cat Rambo and Jennifer Brozek,by Arley Sorg,https://clarkesworldmagazine.com/brozek-rambo_interview,ISSUE 207 , December 2023,Non-fiction
Editor's Desk: Poking Through the Fog,by Neil Clarke,https://clarkesworldmagazine.com/clarke_12_23,ISSUE 207 , December 2023,Non-fiction
The Gift,by Matt Dixon,https://clarkesworldmagazine.com/artbio_207,ISSUE 207 , December 2023,Cover
Nothing of Value,by Aimee Ogden,https://clarkesworldmagazine.com/ogden_01_24,ISSUE 208 , January 2024,Fiction
Down the Waterfall,by Cécile Cristofari,https://clarkesworldmagazine.com/cristofari_01_24,ISSUE 208 , January 2024,Fiction
Binomial Nomenclature and the Mother of Happiness,by Alexandra Munck,https://clarkesworldmagazine.com/munck_01_24,ISSUE 208 , January 2024,Fiction
Stars Don't Dream,"by Chi Hui, translated by John Chu",https://clarkesworldmagazine.com/chi_01_24,ISSUE 208 , January 2024,Fiction
Just Another Cat in a Box,by E.N. Auslender,https://clarkesworldmagazine.com/auslender_01_24,ISSUE 208 , January 2024,Fiction
Rail Meat,by Marie Vibbert,https://clarkesworldmagazine.com/vibbert_01_24,ISSUE 208 , January 2024,Fiction
You Dream of the Hive,by C. M. Fields,https://clarkesworldmagazine.com/fields_01_24,ISSUE 208 , January 2024,Fiction
You Cannot Grow in Salted Earth,by Priya Chand,https://clarkesworldmagazine.com/chand_01_24,ISSUE 208 , January 2024,Fiction
Exercise in Alternate Histories: Unveiling Venus,by Julie Nováková,https://clarkesworldmagazine.com/novakova_01_24,ISSUE 208 , January 2024,Non-fiction
Playing with Legos: A Conversation with Seth Dickinson,by Arley Sorg,https://clarkesworldmagazine.com/dickinson_interview_2024,ISSUE 208 , January 2024,Non-fiction
Finding Mars: A Conversation with Caitlín R. Kiernan,by Arley Sorg,https://clarkesworldmagazine.com/kiernan_interview_2024,ISSUE 208 , January 2024,Non-fiction
Editor's Desk: 2023 in Review,by Neil Clarke,https://clarkesworldmagazine.com/clarke_01_24,ISSUE 208 , January 2024,Non-fiction
Secret Garden,by JC Jongwon Park,https://clarkesworldmagazine.com/artbio_208,ISSUE 208 , January 2024,Cover
Scalp,by H.H. Pak,https://clarkesworldmagazine.com/pak_02_24,ISSUE 209 , February 2024,Fiction
The Flowers That We Intend To Share,by Rajeev Prasad,https://clarkesworldmagazine.com/prasad_02_24,ISSUE 209 , February 2024,Fiction
The Enceladus South Pole Base Named after V.I. Lenin,by Zohar Jacobs,https://clarkesworldmagazine.com/jacobs_02_24,ISSUE 209 , February 2024,Fiction
Kardashev's Palimpsest,by David Goodman,https://clarkesworldmagazine.com/goodman_02_24,ISSUE 209 , February 2024,Fiction
The Peregrine Falcon Flies West,"by Yang Wanqing, translated by Jay Zhang",https://clarkesworldmagazine.com/yang_02_24,ISSUE 209 , February 2024,Fiction
Why Don't We Just Kill the Kid In the Omelas Hole,by Isabel J. Kim,https://clarkesworldmagazine.com/kim_02_24,ISSUE 209 , February 2024,Fiction
The Beam Eidolon,by Ryan Marie Ketterer,https://clarkesworldmagazine.com/ketterer_02_24,ISSUE 209 , February 2024,Fiction
Lonely Ghosts,by Meghan Feldman,https://clarkesworldmagazine.com/feldman_02_24,ISSUE 209 , February 2024,Fiction
Eeriecology: What Nature Remembers and What It Tells Us,by Ben Lockwood,https://clarkesworldmagazine.com/lockwood_02_24,ISSUE 209 , February 2024,Non-fiction
When the World Changes: A Conversation with Wole Talabi,by Arley Sorg,https://clarkesworldmagazine.com/talabi_interview,ISSUE 209 , February 2024,Non-fiction
Tying Together Disparate Concepts: A Conversation with Bogi Takács,by Arley Sorg,https://clarkesworldmagazine.com/takacs_interview,ISSUE 209 , February 2024,Non-fiction
Editor's Desk: 2023 Readers' Poll Finalists,by Neil Clarke,https://clarkesworldmagazine.com/clarke_02_24,ISSUE 209 , February 2024,Non-fiction
Harvesters,by Pablo Munoz Gomez,https://clarkesworldmagazine.com/artbio_209,ISSUE 209 , February 2024,Cover
Hello! Hello! Hello!,by Fiona Jones,https://clarkesworldmagazine.com/jones_03_24,ISSUE 210 , March 2024,Fiction
Phosphorescence,by Ben Berman Ghan,https://clarkesworldmagazine.com/ghan_03_24,ISSUE 210 , March 2024,Fiction
Nine Beauties and the Entangled Threads,by D.A. Xiaolin Spires,https://clarkesworldmagazine.com/spires_03_24,ISSUE 210 , March 2024,Fiction
A Brief Oral History of the El Zopilote Dock,by Alaya Dawn Johnson,https://clarkesworldmagazine.com/johnson_03_24,ISSUE 210 , March 2024,Fiction
One Flew Over the Songhua River,"by Qi Ran, translated by Andy Dudak",https://clarkesworldmagazine.com/qi_03_24,ISSUE 210 , March 2024,Fiction
"Her Body, The Ship",by Z. K. Abraham,https://clarkesworldmagazine.com/abraham_03_24,ISSUE 210 , March 2024,Fiction
Geminoid,by Malena Salazar Maciá,https://clarkesworldmagazine.com/macia_03_24,ISSUE 210 , March 2024,Fiction
"Swarm X1048 - Ethological Field Report: Canis Lupus Familiaris, “6”",by F.E. Choe,https://clarkesworldmagazine.com/choe_03_24,ISSUE 210 , March 2024,Fiction
In a Better Place: Virtual Reality Farming and Science Fiction,by Samantha Hind,https://clarkesworldmagazine.com/hind_03_24,ISSUE 210 , March 2024,Non-fiction
Globalized Literary Space: A Conversation with Bodhisattva Chattopadhyay,by Arley Sorg,https://clarkesworldmagazine.com/chattopadhyay_interview,ISSUE 210 , March 2024,Non-fiction
Cultivating Communities: A Conversation with Izzy Wasserstein,by Arley Sorg,https://clarkesworldmagazine.com/wasserstein_interview,ISSUE 210 , March 2024,Non-fiction
Editor's Desk: The Best from 2023,by Neil Clarke,https://clarkesworldmagazine.com/clarke_03_24,ISSUE 210 , March 2024,Non-fiction
ANCESTOR,by Marco Zagara,https://clarkesworldmagazine.com/artbio_210,ISSUE 210 , March 2024,Cover
